product_id,category_name,name,description,image_url,price,created_by
2239,Indianwear-Women,AURELIA84 - Indianwear-Women,band with placket cotton womens calf length kurta - purple,https://picsum.photos/id/0/200/300,1480.5,84
2240,Indianwear-Women,AURELIA85 - Indianwear-Women,printed viscose round neck womens ethnic set - pink,https://picsum.photos/id/0/200/300,188.07,8
2241,Indianwear-Women,AURELIA86 - Indianwear-Women,printed poly viscose womens ethnic set - white,https://picsum.photos/id/0/200/300,3090.43,23
2242,Indianwear-Women,AURELIA87 - Indianwear-Women,printed polyester round neck womens ethnic set - green,https://picsum.photos/id/0/200/300,7130.31,15
2243,Indianwear-Women,AURELIA88 - Indianwear-Women,printed viscose blend regular fit womens kurta set - green,https://picsum.photos/id/0/200/300,5421.54,99
2244,Indianwear-Women,AURELIA89 - Indianwear-Women,round neck cotton womens knee length kurta - orange,https://picsum.photos/id/0/200/300,9653.15,32
2245,Indianwear-Women,AURELIA90 - Indianwear-Women,printed viscose regular fit womens palazzo - peach,https://picsum.photos/id/0/200/300,5377.08,27
2246,Indianwear-Women,AURELIA91 - Indianwear-Women,solid cotton blend womens casual trousers - pink,https://picsum.photos/id/0/200/300,7892.77,98
2247,Indianwear-Women,AURELIA92 - Indianwear-Women,dyed cotton round neck womens straight kurta - green,https://picsum.photos/id/0/200/300,8080.38,94
2248,Indianwear-Women,AURELIA93 - Indianwear-Women,solid band with v cotton blend womens knee length kurta - yellow,https://picsum.photos/id/0/200/300,4014.49,15
2249,Indianwear-Women,AURELIA94 - Indianwear-Women,round neck cotton womens calf length kurta - navy,https://picsum.photos/id/0/200/300,967.44,101
2250,Indianwear-Women,AURELIA95 - Indianwear-Women,yarn dyed cotton collar neck womens a line kurta - navy,https://picsum.photos/id/0/200/300,5432.21,95
2251,Indianwear-Women,AURELIA96 - Indianwear-Women,solid cotton blend womens casual trousers - black,https://picsum.photos/id/0/200/300,1471.71,56
2252,Indianwear-Women,AURELIA97 - Indianwear-Women,printed cotton mandarin womens straight kurta - grey,https://picsum.photos/id/0/200/300,4523.58,38
2253,Indianwear-Women,AURELIA98 - Indianwear-Women,solid georgette round neck womens ethnic set - yellow,https://picsum.photos/id/0/200/300,101.79,15
2254,Indianwear-Women,AURELIA99 - Indianwear-Women,dyed cotton womens straight kurta - navy,https://picsum.photos/id/0/200/300,2616.18,103
2255,Indianwear-Women,AURELIA100 - Indianwear-Women,printed polyester v neck womens straight kurta - blue,https://picsum.photos/id/0/200/300,9139.72,43
2256,Indianwear-Women,AURELIA101 - Indianwear-Women,printed polyester round neck womens ankle length kurta - brown,https://picsum.photos/id/0/200/300,5533.87,36
2257,Indianwear-Women,AURELIA102 - Indianwear-Women,solid polyester mandarin womens straight kurta - black,https://picsum.photos/id/0/200/300,7441.88,62
2258,Indianwear-Women,AURELIA103 - Indianwear-Women,solid cotton flex regular fit womens casual trousers - pink,https://picsum.photos/id/0/200/300,1107.49,1
2259,Indianwear-Women,AURELIA104 - Indianwear-Women,solid cotton flex regular fit womens casual culottes - green,https://picsum.photos/id/0/200/300,4452.59,48
2260,Indianwear-Women,AURELIA105 - Indianwear-Women,yarn dyed round neck straight womens kurta - navy,https://picsum.photos/id/0/200/300,4640.03,80
2261,Indianwear-Women,AURELIA106 - Indianwear-Women,dyed cotton round neck womens ethnic set - purple,https://picsum.photos/id/0/200/300,6626.03,79
2262,Indianwear-Women,AURELIA107 - Indianwear-Women,printed cotton womens casual palazzo - blue,https://picsum.photos/id/0/200/300,7465.14,101
2263,Indianwear-Women,AURELIA108 - Indianwear-Women,printed polyester womens straight kurta - pink,https://picsum.photos/id/0/200/300,2159.38,70
2264,Indianwear-Women,AURELIA109 - Indianwear-Women,round neck cotton womens below knee kurta - multi,https://picsum.photos/id/0/200/300,5399.38,68
2265,Indianwear-Women,AURELIA110 - Indianwear-Women,printed cotton round neck womens straight kurta - yellow,https://picsum.photos/id/0/200/300,9942.19,65
2266,Indianwear-Women,AURELIA111 - Indianwear-Women,band with placket cotton womens knee length kurta - green,https://picsum.photos/id/0/200/300,8015.56,80
2267,Indianwear-Women,AURELIA112 - Indianwear-Women,printed 60's cambric womens non festive culottes - blue,https://picsum.photos/id/0/200/300,113.77,11
2268,Indianwear-Women,AURELIA113 - Indianwear-Women,printed poly blend womens festive dupatta - red,https://picsum.photos/id/0/200/300,5318.19,102
2269,Indianwear-Women,AURELIA114 - Indianwear-Women,printed viscose womens ethnic set - pink,https://picsum.photos/id/0/200/300,6784.03,90
2270,Indianwear-Women,AURELIA115 - Indianwear-Women,round neck straight designer womens kurtas - blue,https://picsum.photos/id/0/200/300,4894.22,94
2271,Indianwear-Women,AURELIA116 - Indianwear-Women,printed viscose blend womens regular fit palazzo - pink,https://picsum.photos/id/0/200/300,9463.2,78
2272,Indianwear-Women,AURELIA117 - Indianwear-Women,printed viscose round neck womens ethnic set - green,https://picsum.photos/id/0/200/300,1282.53,40
2273,Indianwear-Women,AURELIA118 - Indianwear-Women,solid cotton blend band with v womens kurta set - yellow,https://picsum.photos/id/0/200/300,8387.57,59
2274,Indianwear-Women,AURELIA119 - Indianwear-Women,regular fit polyester womens festive skirt - multi,https://picsum.photos/id/0/200/300,8752.82,98
2275,Indianwear-Women,AURELIA120 - Indianwear-Women,printed polyester v neck womens ethnic set - blue,https://picsum.photos/id/0/200/300,2271.53,31
2276,Indianwear-Women,AURELIA121 - Indianwear-Women,printed viscose v-neck womens flared dress - black,https://picsum.photos/id/0/200/300,5563.16,24
2277,Indianwear-Women,AURELIA122 - Indianwear-Women,printed viscose mandarin womens straight kurta - pink,https://picsum.photos/id/0/200/300,9201.46,47
2278,Indianwear-Women,AURELIA123 - Indianwear-Women,boat neck cotton womens knee length kurta - blue,https://picsum.photos/id/0/200/300,9680.21,83
2279,Indianwear-Women,AURELIA124 - Indianwear-Women,dyed cotton regular fit womens dupatta - pink,https://picsum.photos/id/0/200/300,1350.11,9
2280,Indianwear-Women,AURELIA125 - Indianwear-Women,yarn dyed cotton regular fit womens casual wear dupatta - blue,https://picsum.photos/id/0/200/300,3969.14,74
2281,Indianwear-Women,AURELIA126 - Indianwear-Women,round neck cotton womens calf length kurta - white,https://picsum.photos/id/0/200/300,3313.61,99
2282,Indianwear-Women,AURELIA127 - Indianwear-Women,collar neck polyester a line designer womens dresses - natural,https://picsum.photos/id/0/200/300,3137.03,80
2283,Indianwear-Women,AURELIA128 - Indianwear-Women,printed crepe mandarin womens flared kurta - orange,https://picsum.photos/id/0/200/300,6163.42,101
2284,Indianwear-Women,AURELIA129 - Indianwear-Women,yarn dyed round neck straight womens kurta - gold,https://picsum.photos/id/0/200/300,4330.45,38
2285,Indianwear-Women,AURELIA130 - Indianwear-Women,printed viscose round neck womens straight kurta - peach,https://picsum.photos/id/0/200/300,9665.32,103
2286,Indianwear-Women,AURELIA131 - Indianwear-Women,printed polyester regular fit womens dress - grey,https://picsum.photos/id/0/200/300,7256.66,102
2287,Indianwear-Women,AURELIA132 - Indianwear-Women,solid round neck cotton blend womens knee length kurta - black,https://picsum.photos/id/0/200/300,628.39,94
2288,Indianwear-Women,AURELIA133 - Indianwear-Women,dyed polyester round neck womens straight kurta - blue,https://picsum.photos/id/0/200/300,7303.55,96
2289,Indianwear-Women,AURELIA134 - Indianwear-Women,printed polyester womens flared dress - black,https://picsum.photos/id/0/200/300,3650.96,90
2290,Indianwear-Women,AURELIA135 - Indianwear-Women,printed round neck straight womens kurta - off white,https://picsum.photos/id/0/200/300,7762.01,80
2291,Indianwear-Women,AURELIA136 - Indianwear-Women,printed polyester womens festive palazzo - green,https://picsum.photos/id/0/200/300,8548.76,43
2292,Indianwear-Women,AURELIA137 - Indianwear-Women,mandarin straight designer womens kurtas - peach,https://picsum.photos/id/0/200/300,6480.91,39
2293,Indianwear-Women,AURELIA138 - Indianwear-Women,dyed cotton womens straight kurta - green,https://picsum.photos/id/0/200/300,5520.27,104
2294,Indianwear-Women,AURELIA139 - Indianwear-Women,printed polyester round neck womens ethnic set - natural,https://picsum.photos/id/0/200/300,9219.44,59
2295,Indianwear-Women,AURELIA140 - Indianwear-Women,dyed cotton womens straight kurta - blue,https://picsum.photos/id/0/200/300,4810.2,99
2296,Indianwear-Women,AURELIA141 - Indianwear-Women,solid american crepe womens non festive palazzo - white,https://picsum.photos/id/0/200/300,2900.92,43
2297,Indianwear-Women,AURELIA142 - Indianwear-Women,dyed cotton round neck womens ethnic set - green,https://picsum.photos/id/0/200/300,4605.25,70
2298,Indianwear-Women,AURELIA143 - Indianwear-Women,yarn dyed band with placket straight womens kurta - peach,https://picsum.photos/id/0/200/300,1946.45,76
2299,Indianwear-Women,AURELIA144 - Indianwear-Women,regular fit polyester womens festive skirt - pink,https://picsum.photos/id/0/200/300,6192.19,21
2300,Indianwear-Women,AURELIA145 - Indianwear-Women,printed silver chiffon regular fit womens casual wear dupatta - yellow,https://picsum.photos/id/0/200/300,4944.32,40
2301,Indianwear-Women,AURELIA146 - Indianwear-Women,printed viscose round neck womens ethnic set - peach,https://picsum.photos/id/0/200/300,2747.51,9
2302,Indianwear-Women,AURELIA147 - Indianwear-Women,printed cotton blend mandarin womens kurta set - white,https://picsum.photos/id/0/200/300,453.85,16
2303,Indianwear-Women,AURELIA148 - Indianwear-Women,dyed cotton mandarin womens a line kurta - black,https://picsum.photos/id/0/200/300,1272.23,9
2304,Indianwear-Women,AURELIA149 - Indianwear-Women,solid viscose v-neck womens above knee kurta - pink,https://picsum.photos/id/0/200/300,6395.52,38
2305,Indianwear-Women,AURELIA150 - Indianwear-Women,cotton rayon round neck womens kurta - off white,https://picsum.photos/id/0/200/300,1283.09,56
2306,Indianwear-Women,AURELIA151 - Indianwear-Women,dyed viscose v neck womens straight kurta - red,https://picsum.photos/id/0/200/300,9329.31,76
2307,Indianwear-Women,AURELIA152 - Indianwear-Women,printed polyester blend womens festive palazzo - gold,https://picsum.photos/id/0/200/300,8776.08,27
2308,Indianwear-Women,AURELIA153 - Indianwear-Women,printed chanderi round neck womens ethnic set - blue,https://picsum.photos/id/0/200/300,3537.41,56
2309,Indianwear-Women,AURELIA154 - Indianwear-Women,printed viscose round neck womens straight kurta - yellow,https://picsum.photos/id/0/200/300,7417.71,9
2310,Indianwear-Women,AURELIA155 - Indianwear-Women,printed round neck straight womens kurta - yellow,https://picsum.photos/id/0/200/300,9957.12,94
2311,Indianwear-Women,AURELIA156 - Indianwear-Women,round neck cotton womens knee length kurta - orange,https://picsum.photos/id/0/200/300,2777.2,94
2312,Indianwear-Women,AURELIA157 - Indianwear-Women,printed georgette womens ethnic set - blue,https://picsum.photos/id/0/200/300,9922.75,42
2313,Indianwear-Women,AURELIA158 - Indianwear-Women,dyed rayon womens ethnic set - green,https://picsum.photos/id/0/200/300,9966.06,31
2314,Indianwear-Women,AURELIA159 - Indianwear-Women,solid band with v cotton blend womens knee length kurta - peach,https://picsum.photos/id/0/200/300,7174.99,97
2315,Indianwear-Women,AURELIA160 - Indianwear-Women,round neck rayon womens below knee kurta - green,https://picsum.photos/id/0/200/300,4262.27,84
2316,Indianwear-Women,AURELIA161 - Indianwear-Women,printed viscose mandarin womens flared dress - olive,https://picsum.photos/id/0/200/300,8792.07,94
2317,Indianwear-Women,AURELIA162 - Indianwear-Women,printed band neck with slit straight womens kurta - blue,https://picsum.photos/id/0/200/300,8087.09,70
2318,Indianwear-Women,AURELIA163 - Indianwear-Women,printed rayon blend round neck womens straight kurta - white,https://picsum.photos/id/0/200/300,275.83,31
2319,Indianwear-Women,AURELIA164 - Indianwear-Women,viscose poly womens festive trousers - multi,https://picsum.photos/id/0/200/300,799.76,84
2320,Indianwear-Women,AURELIA165 - Indianwear-Women,printed round neck polyester womens flared dress - navy,https://picsum.photos/id/0/200/300,3081.21,31
2321,Indianwear-Women,AURELIA166 - Indianwear-Women,printed polyester round neck womens straight kurta - blue,https://picsum.photos/id/0/200/300,8070.96,11
2322,Indianwear-Women,AURELIA167 - Indianwear-Women,dyed cotton womens ethnic set - navy,https://picsum.photos/id/0/200/300,3264.66,24
2323,Indianwear-Women,AURELIA168 - Indianwear-Women,printed round neck viscose womens calf length kurta - blue,https://picsum.photos/id/0/200/300,4766.73,76
2324,Indianwear-Women,AURELIA169 - Indianwear-Women,printed band with placket straight womens kurta - orange,https://picsum.photos/id/0/200/300,9304.11,8
2325,Indianwear-Women,AURELIA170 - Indianwear-Women,printed round neck straight womens kurta - maroon,https://picsum.photos/id/0/200/300,2463.47,8
2326,Indianwear-Women,AURELIA171 - Indianwear-Women,printed polyester mandarin womens flared dress - green,https://picsum.photos/id/0/200/300,8935.0,11
2327,Indianwear-Women,AURELIA172 - Indianwear-Women,printed viscose round neck womens straight kurta - yellow,https://picsum.photos/id/0/200/300,5478.83,76
2328,Indianwear-Women,AURELIA173 - Indianwear-Women,mandarin straight designer womens kurtas - yellow,https://picsum.photos/id/0/200/300,5075.69,40
2329,Indianwear-Women,AURELIA174 - Indianwear-Women,solid cotton flex regular fit womens casual trousers - blue,https://picsum.photos/id/0/200/300,3705.74,76
2330,Indianwear-Women,AURELIA175 - Indianwear-Women,dyed regular fit viscose blend womens casual trousers - grey,https://picsum.photos/id/0/200/300,4977.01,15
2331,Indianwear-Women,AURELIA176 - Indianwear-Women,printed polyester womens flared dress - green,https://picsum.photos/id/0/200/300,9403.52,24
2332,Indianwear-Women,AURELIA177 - Indianwear-Women,dyed cotton mandarin womens a line kurta - pink,https://picsum.photos/id/0/200/300,5800.09,76
2333,Indianwear-Women,AURELIA178 - Indianwear-Women,printed polyester regular fit womens dupatta - orange,https://picsum.photos/id/0/200/300,5385.35,23
2334,Indianwear-Women,AURELIA179 - Indianwear-Women,yarn dyed cotton regular fit womens casual wear dupatta - yellow,https://picsum.photos/id/0/200/300,5668.12,27
2335,Indianwear-Women,AURELIA180 - Indianwear-Women,printed round neck straight womens kurta - green,https://picsum.photos/id/0/200/300,4921.72,80
2336,Indianwear-Women,AURELIA181 - Indianwear-Women,printed round neck cotton womens knee length kurta - yellow,https://picsum.photos/id/0/200/300,2442.45,21
2337,Indianwear-Women,AURELIA182 - Indianwear-Women,cotton lycra woven womens tights - yellow,https://picsum.photos/id/0/200/300,628.92,98
2338,Indianwear-Women,AURELIA183 - Indianwear-Women,mandarin straight designer womens kurtas - blue,https://picsum.photos/id/0/200/300,237.82,90
2339,Indianwear-Women,AURELIA184 - Indianwear-Women,printed polyester round neck womens ethnic set - brown,https://picsum.photos/id/0/200/300,9780.51,31
2340,Indianwear-Women,AURELIA185 - Indianwear-Women,dyed cotton womens festive dupatta - gold,https://picsum.photos/id/0/200/300,138.55,76
2341,Indianwear-Women,AURELIA186 - Indianwear-Women,printed viscose round neck womens ethnic set - pink,https://picsum.photos/id/0/200/300,3824.55,80
2342,Indianwear-Women,AURELIA187 - Indianwear-Women,yarn dyed round neck straight womens kurta - pink,https://picsum.photos/id/0/200/300,9343.59,74
2343,Indianwear-Women,AURELIA188 - Indianwear-Women,round neck straight designer womens kurtas - blue,https://picsum.photos/id/0/200/300,4815.0,92
2344,Indianwear-Women,AURELIA189 - Indianwear-Women,yarn dyed band neck with slit herringbone stripe womens flared dress - navy,https://picsum.photos/id/0/200/300,2875.88,81
2345,Indianwear-Women,AURELIA190 - Indianwear-Women,printed polyester round neck womens ethnic set - yellow,https://picsum.photos/id/0/200/300,9386.58,81
2346,Indianwear-Women,AURELIA191 - Indianwear-Women,printed band collar straight womens kurta - wine,https://picsum.photos/id/0/200/300,8813.08,6
2347,Indianwear-Women,AURELIA192 - Indianwear-Women,dyed poly viscose round neck womens flared kurta - green,https://picsum.photos/id/0/200/300,224.85,16
2348,Indianwear-Women,AURELIA193 - Indianwear-Women,printed polyester round neck womens ethnic set - blue,https://picsum.photos/id/0/200/300,716.11,27
2349,Indianwear-Women,AURELIA194 - Indianwear-Women,band with placket cotton womens knee length kurta - natural,https://picsum.photos/id/0/200/300,2086.5,76
2350,Indianwear-Women,AURELIA195 - Indianwear-Women,dyed rayon womens ethnic set - peach,https://picsum.photos/id/0/200/300,6285.76,96
2351,Indianwear-Women,AURELIA196 - Indianwear-Women,printed georgette round neck womens flared kurta - yellow,https://picsum.photos/id/0/200/300,2871.93,23
2352,Indianwear-Women,AURELIA197 - Indianwear-Women,dyed collared neck viscose womens straight fit dress - blue,https://picsum.photos/id/0/200/300,3602.83,11
2353,Indianwear-Women,AURELIA198 - Indianwear-Women,dyed regular length cotton woven womens dupatta - pink,https://picsum.photos/id/0/200/300,8978.13,27
2354,Indianwear-Women,AURELIA199 - Indianwear-Women,printed viscose round neck womens straight kurta - pink,https://picsum.photos/id/0/200/300,488.05,1
2355,Indianwear-Women,AURELIA200 - Indianwear-Women,printed viscose womens festive palazzo - white,https://picsum.photos/id/0/200/300,6463.51,23
2356,Indianwear-Women,AURELIA201 - Indianwear-Women,band with placket cotton womens knee length kurta - yellow,https://picsum.photos/id/0/200/300,4636.21,56
2357,Indianwear-Women,AURELIA202 - Indianwear-Women,round neck rayon womens below knee kurta - blue,https://picsum.photos/id/0/200/300,6230.03,88
2358,Indianwear-Women,AURELIA203 - Indianwear-Women,dyed cotton round neck womens straight kurta - red,https://picsum.photos/id/0/200/300,5223.8,42
2359,Indianwear-Women,AURELIA204 - Indianwear-Women,printed viscose round neck womens flared dress - red,https://picsum.photos/id/0/200/300,6880.66,27
2360,Indianwear-Women,AURELIA205 - Indianwear-Women,dyed viscose round neck womens above knee kurta - white,https://picsum.photos/id/0/200/300,3293.65,24
2361,Indianwear-Women,AURELIA206 - Indianwear-Women,dyed regular length cotton woven womens dupatta - blue,https://picsum.photos/id/0/200/300,5837.76,102
2362,Indianwear-Women,AURELIA207 - Indianwear-Women,round neck cotton womens knee length kurta - green,https://picsum.photos/id/0/200/300,4031.86,56
2363,Indianwear-Women,AURELIA208 - Indianwear-Women,dyed cotton boat neck womens straight kurta - black,https://picsum.photos/id/0/200/300,528.53,68
2364,Indianwear-Women,AURELIA209 - Indianwear-Women,printed polyester round neck womens ethnic set - blue,https://picsum.photos/id/0/200/300,8068.65,49
2365,Indianwear-Women,AURELIA210 - Indianwear-Women,dyed regular fit cotton womens casual trousers - purple,https://picsum.photos/id/0/200/300,781.25,34
2366,Indianwear-Women,AURELIA211 - Indianwear-Women,dyed cotton round neck womens straight kurta - green,https://picsum.photos/id/0/200/300,5542.58,32
2367,Indianwear-Women,AURELIA212 - Indianwear-Women,dyed cotton round neck womens ethnic set - green,https://picsum.photos/id/0/200/300,3015.72,94
2368,Indianwear-Women,AURELIA213 - Indianwear-Women,dyed cotton round neck womens above knee kurta - blue,https://picsum.photos/id/0/200/300,3230.27,94
2369,Indianwear-Women,AURELIA214 - Indianwear-Women,printed cotton round neck womens straight kurta - yellow,https://picsum.photos/id/0/200/300,584.25,15
2370,Indianwear-Women,AURELIA215 - Indianwear-Women,mandarin straight designer womens kurtas - orange,https://picsum.photos/id/0/200/300,1952.37,94
2371,Indianwear-Women,AURELIA216 - Indianwear-Women,solid cotton blend womens casual trousers - pink,https://picsum.photos/id/0/200/300,5300.42,32
2372,Indianwear-Women,AURELIA217 - Indianwear-Women,dyed poly viscose round neck womens ethnic set - multi,https://picsum.photos/id/0/200/300,4993.18,1
2373,Indianwear-Women,AURELIA218 - Indianwear-Women,solid cotton flex regular fit womens casual palazzo - blue,https://picsum.photos/id/0/200/300,2957.73,33
2374,Indianwear-Women,AURELIA219 - Indianwear-Women,collar neck polyester flared designer womens dresses - green,https://picsum.photos/id/0/200/300,6800.35,83
2375,Indianwear-Women,AURELIA220 - Indianwear-Women,printed cotton round neck womens flared dress - pink,https://picsum.photos/id/0/200/300,905.48,80
2376,Indianwear-Women,AURELIA221 - Indianwear-Women,dyed cotton regular fit womens casual dupatta - white,https://picsum.photos/id/0/200/300,1810.96,54
2377,Indianwear-Women,AURELIA222 - Indianwear-Women,printed polyester blend womens straight kurta - blue,https://picsum.photos/id/0/200/300,9320.63,12
2378,Indianwear-Women,AURELIA223 - Indianwear-Women,dyed cotton round neck womens straight kurta - green,https://picsum.photos/id/0/200/300,2659.48,40
2379,Indianwear-Women,AURELIA224 - Indianwear-Women,printed cotton round neck womens ethnic set - pink,https://picsum.photos/id/0/200/300,3636.52,33
2380,Indianwear-Women,AURELIA225 - Indianwear-Women,printed viscose round neck womens straight kurta - blue,https://picsum.photos/id/0/200/300,6343.16,81
2381,Indianwear-Women,AURELIA226 - Indianwear-Women,dyed cotton round neck womens straight kurta - green,https://picsum.photos/id/0/200/300,9176.8,96
2382,Indianwear-Women,AURELIA227 - Indianwear-Women,dyed cotton womens flared dress - black,https://picsum.photos/id/0/200/300,7250.79,15
2383,Indianwear-Women,AURELIA228 - Indianwear-Women,mandarin straight designer womens kurtas - grey,https://picsum.photos/id/0/200/300,5941.05,54
2384,Indianwear-Women,AURELIA229 - Indianwear-Women,printed viscose round neck womens knee length kurta - blue,https://picsum.photos/id/0/200/300,8598.29,54
2385,Indianwear-Women,AURELIA230 - Indianwear-Women,mandarin straight designer womens kurtas - yellow,https://picsum.photos/id/0/200/300,3536.65,27
2386,Indianwear-Women,AURELIA231 - Indianwear-Women,yarn dyed round neck dobby womens a-line dress - yellow,https://picsum.photos/id/0/200/300,6546.62,80
2387,Indianwear-Women,AURELIA232 - Indianwear-Women,cotton round neck womens kurta set - orange,https://picsum.photos/id/0/200/300,3674.73,96
2388,Indianwear-Women,AURELIA233 - Indianwear-Women,yarn dyed shirt collar with placket twill stripe womens a-line dress - peach,https://picsum.photos/id/0/200/300,1281.69,59
2389,Indianwear-Women,AURELIA234 - Indianwear-Women,solid regular fit cotton lycra womens casual pants - red,https://picsum.photos/id/0/200/300,1819.19,84
2390,Indianwear-Women,AURELIA235 - Indianwear-Women,printed cotton womens casual culottes - yellow,https://picsum.photos/id/0/200/300,2706.38,31
2391,Indianwear-Women,AURELIA236 - Indianwear-Women,dyed regular length cotton woven womens dupatta - gold,https://picsum.photos/id/0/200/300,461.4,11
2392,Indianwear-Women,AURELIA237 - Indianwear-Women,printed poly blend womens festive dupatta - white,https://picsum.photos/id/0/200/300,1864.16,16
2393,Indianwear-Women,AURELIA238 - Indianwear-Women,printed band with v polyester womens knee length kurta - multi,https://picsum.photos/id/0/200/300,8655.79,47
2394,Indianwear-Women,AURELIA239 - Indianwear-Women,printed round neck viscose womens calf length kurta - white,https://picsum.photos/id/0/200/300,2944.69,100
2395,Indianwear-Women,AURELIA240 - Indianwear-Women,solid round neck cotton blend womens knee length kurta - white,https://picsum.photos/id/0/200/300,6817.32,68
2396,Indianwear-Women,AURELIA241 - Indianwear-Women,printed viscose round neck womens ethnic set - pink,https://picsum.photos/id/0/200/300,216.97,3
2397,Indianwear-Women,AURELIA242 - Indianwear-Women,printed viscose regular fit womens kurta set - white,https://picsum.photos/id/0/200/300,6003.17,97
2398,Indianwear-Women,AURELIA243 - Indianwear-Women,printed viscose regular fit womens culottes - pink,https://picsum.photos/id/0/200/300,728.65,24
2399,Indianwear-Women,AURELIA244 - Indianwear-Women,printed viscose womens ethnic set - pink,https://picsum.photos/id/0/200/300,3541.91,95
2400,Indianwear-Women,AURELIA245 - Indianwear-Women,dyed poly viscose regular fit womens festive trousers - white,https://picsum.photos/id/0/200/300,7286.85,21
2401,Indianwear-Women,AURELIA246 - Indianwear-Women,printed polyester mandarin womens ethnic set - blue,https://picsum.photos/id/0/200/300,4424.99,79
2402,Indianwear-Women,AURELIA247 - Indianwear-Women,yarn dyed cotton round neck womens straight kurta - red,https://picsum.photos/id/0/200/300,6828.99,72
2403,Indianwear-Women,AURELIA248 - Indianwear-Women,printed polyester spandex womens casual tights - gold,https://picsum.photos/id/0/200/300,982.96,33
2404,Indianwear-Women,AURELIA249 - Indianwear-Women,mandarin straight designer womens kurtas - pink,https://picsum.photos/id/0/200/300,4082.75,39
2405,Indianwear-Women,AURELIA250 - Indianwear-Women,printed viscose womens ethnic set - green,https://picsum.photos/id/0/200/300,4362.24,48
2406,Indianwear-Women,AURELIA251 - Indianwear-Women,dyed cotton mandarin neck womens above knee kurta - pink,https://picsum.photos/id/0/200/300,5525.85,33
2407,Indianwear-Women,AURELIA252 - Indianwear-Women,yarn dyed shirt collar straight womens kurta - green,https://picsum.photos/id/0/200/300,1720.88,96
2408,Indianwear-Women,AURELIA253 - Indianwear-Women,round neck viscose flared designer womens dresses - red,https://picsum.photos/id/0/200/300,4392.62,90
2409,Indianwear-Women,AURELIA254 - Indianwear-Women,dyed cotton blend mandarin womens straight kurta - blue,https://picsum.photos/id/0/200/300,6080.37,39
